PMID,Title,Authors,Journal,Publication Date,Abstract,DOI,Keywords
35757486,Cephalometric Analysis in Orthodontics Using Artificial Intelligence-A Comprehensive Review.,"Subramanian, Aravind Kumar; Chen, Yong; Almalki, Abdullah; Sivamurthy, Gautham; Kafle, Dashrath",BioMed research international,2022,"Artificial intelligence (AI) is a branch of science concerned with developing programs and computers that can gather data, reason about it, and then translate it into intelligent actions. AI is a broad area that includes reasoning, typical linguistic dispensation, machine learning, and planning. In the area of medicine and dentistry, machine learning is currently the most widely used AI application. This narrative review is aimed at giving an outline of cephalometric analysis in orthodontics using AI. Latest algorithms are developing rapidly, and computational resources are increasing, resulting in increased efficiency, accuracy, and reliability. Current techniques for completely automatic identification of cephalometric landmarks have considerably improved efficiency and growth prospects for their regular use. The primary considerations for effective orthodontic treatment are an accurate diagnosis, exceptional treatment planning, and good prognosis estimation. The main objective of the AI technique is to make dentists' work more precise and accurate. AI is increasingly being used in the area of orthodontic treatment. It has been evidenced to be a time-saving and reliable tool in many ways. AI is a promising tool for facilitating cephalometric tracing in routine clinical practice and analyzing large databases for research purposes.",10.1126/science.1411538,
31633462,Evolution of Aesthetic Dentistry.,"Blatz, M B; Chiche, G; Bahat, O; Roblee, R; Coachman, C; Heymann, H O",Journal of dental research,Nov 2019,"One of the main goals of dental treatment is to mimic teeth and design smiles in a most natural and aesthetic manner, based on the individual and specific needs of the patient. Possibilities to reach that goal have significantly improved over the last decade through new and specific treatment modalities, steadily enhanced and more aesthetic dental materials, and novel techniques and technologies. This article gives an overview of the evolution of aesthetic dentistry over the past 100 y from a historical point of view and highlights advances in the development of dental research and clinical interventions that have contributed the science and art of aesthetic dentistry. Among the most noteworthy advancements over the past decade are the establishment of universal aesthetic rules and guidelines based on the assessment of natural aesthetic parameters, anatomy, and physiognomy; the development of tooth whitening and advanced restorative as well as prosthetic materials and techniques, supported by the pioneering discovery of dental adhesion; the significant progress in orthodontics and periodontal as well as oral and maxillofacial surgery; and, most recently, the implementation of digital technologies in the 3-dimensional planning and realization of truly natural, individual, and aesthetic smiles. In the future, artificial intelligence and machine learning will likely lead to automation of aesthetic evaluation, smile design, and treatment-planning processes.",10.1177/0022034519875450,cosmetic dentistry; maxillofacial surgery; orthodontic(s); periodontal medicine; prosthetic dentistry/prosthodontics; restorative dentistry
38402191,Artificial intelligence for radiographic imaging detection of caries lesions: a systematic review.,"Albano, Domenico; Galiano, Vanessa; Basile, Mariachiara; Di Luca, Filippo; Gitto, Salvatore; Messina, Carmelo; Cagetti, Maria Grazia; Del Fabbro, Massimo; Tartaglia, Gianluca Martino; Sconfienza, Luca Maria",BMC oral health,24 Feb 2024,"The aim of this systematic review is to evaluate the diagnostic performance of Artificial Intelligence (AI) models designed for the detection of caries lesion (CL). An electronic literature search was conducted on PubMed, Web of Science, SCOPUS, LILACS and Embase databases for retrospective, prospective and cross-sectional studies published until January 2023, using the following keywords: artificial intelligence (AI), machine learning (ML), deep learning (DL), artificial neural networks (ANN), convolutional neural networks (CNN), deep convolutional neural networks (DCNN), radiology, detection, diagnosis and dental caries (DC). The quality assessment was performed using the guidelines of QUADAS-2. Twenty articles that met the selection criteria were evaluated. Five studies were performed on periapical radiographs, nine on bitewings, and six on orthopantomography. The number of imaging examinations included ranged from 15 to 2900. Four studies investigated ANN models, fifteen CNN models, and two DCNN models. Twelve were retrospective studies, six cross-sectional and two prospective. The following diagnostic performance was achieved in detecting CL: sensitivity from 0.44 to 0.86, specificity from 0.85 to 0.98, precision from 0.50 to 0.94, PPV (Positive Predictive Value) 0.86, NPV (Negative Predictive Value) 0.95, accuracy from 0.73 to 0.98, area under the curve (AUC) from 0.84 to 0.98, intersection over union of 0.3-0.4 and 0.78, Dice coefficient 0.66 and 0.88, F1-score from 0.64 to 0.92. According to the QUADAS-2 evaluation, most studies exhibited a low risk of bias. AI-based models have demonstrated good diagnostic performance, potentially being an important aid in CL detection. Some limitations of these studies are related to the size and heterogeneity of the datasets. Future studies need to rely on comparable, large, and clinically meaningful datasets. PROSPERO identifier: CRD42023470708.",10.21037/atm-21-2197,Artificial intelligence; Caries lesion; Detection; Diagnosis; Radiographic imaging
39093229,Artificial intelligence applications in dentistry: A bibliometric review with an emphasis on computational research trends within the field.,"Zatt, Fernanda Pretto; Rocha, Aurélio de Oliveira; Anjos, Lucas Menezes Dos; Caldas, Ricardo Armini; Cardoso, Mariane; Rabelo, Gustavo Davi",Journal of the American Dental Association (1939),Sep 2024,"The aim of this study was to understand the trends regarding the use of artificial intelligence in dentistry through a bibliometric review. The authors performed a literature search on Web of Science. They collected the following data: articles-number and density of citations, year, key words, language, document type, study design, and theme (main objective, diagnostic method, and specialties); journals-impact factor; authors-country, continent, and institution. The authors used Visualization of Similarities Viewer software (Leiden University) to analyze the data and Spearman test for correlation analysis. After selection, 1,478 articles were included. The number of citations ranged from 0 through 327. The articles were published from 1984 through 2024. Most articles were characterized as proof of concept (979). Definition and classification of structures and diseases was the most common theme (550 articles). There was an emphasis on radiology (333 articles) and radiographic-based diagnostic methods (715 articles). China was the country with the most articles (251), and Asia was the continent with the most articles (871). The Charité-University of Medicine Berlin was the institution with the most articles (42), and the author with the most articles was Schwendicke (53). Artificial intelligence is an important clinical tool to facilitate diagnosis and provide automation in various processes.",10.1016/j.adaj.2024.05.013,Deep learning; bibliometrics; dentistry; machine learning
36965859,Artificial intelligence and augmented reality for guided implant surgery planning: A proof of concept.,"Mangano, Francesco Guido; Admakin, Oleg; Lerner, Henriette; Mangano, Carlo",Journal of dentistry,Jun 2023,"To present a novel protocol for authentic three-dimensional (3D) planning of dental implants, using artificial intelligence (AI) and augmented reality (AR). The novel protocol consists of (1) 3D data acquisition, with an intraoral scanner (IOS) and cone-beam computed tomography (CBCT); (2) application of AI for CBCT segmentation to obtain standard tessellation language (STL) models and automatic alignment with IOS models; (3) loading of selected STL models within the AR system and surgical planning with holograms; (4) surgical guide design with open-source computer-assisted-design (CAD) software; and (5) surgery on the patient. This novel protocol is effective and time-efficient when used for planning simple cases of static guided implant surgery in the partially edentulous patient. The clinician can plan the implants in an authentic 3D environment, without using any radiological guided surgery software. The precision of implant placement looks clinically acceptable, with minor deviations. AI and AR technologies can be successfully used in guided implant surgery for authentic 3D planning that may replace conventional software. However, further clinical studies are needed to validate this protocol. The combined use of AI and AR may change the perspectives of modern guided implant surgery for authentic 3D planning that may replace conventional software.",10.1016/j.jdent.2023.104485,Artificial intelligence; Augmented reality; Guided implant surgery planning
38336018,Artificial intelligence serving pre-surgical digital implant planning: A scoping review.,"Elgarba, Bahaaeldeen M; Fontenele, Rocharles Cavalcante; Tarce, Mihai; Jacobs, Reinhilde",Journal of dentistry,Apr 2024,"To conduct a scoping review focusing on artificial intelligence (AI) applications in presurgical dental implant planning. Additionally, to assess the automation degree of clinically available pre-surgical implant planning software. A systematic electronic literature search was performed in five databases (PubMed, Embase, Web of Science, Cochrane Library, and Scopus), along with exploring gray literature web-based resources until November 2023. English-language studies on AI-driven tools for digital implant planning were included based on an independent evaluation by two reviewers. An assessment of automation steps in dental implant planning software available on the market up to November 2023 was also performed. From an initial 1,732 studies, 47 met eligibility criteria. Within this subset, 39 studies focused on AI networks for anatomical landmark-based segmentation, creating virtual patients. Eight studies were dedicated to AI networks for virtual implant placement. Additionally, a total of 12 commonly available implant planning software applications were identified and assessed for their level of automation in pre-surgical digital implant workflows. Notably, only six of these featured at least one fully automated step in the planning software, with none possessing a fully automated implant planning protocol. AI plays a crucial role in achieving accurate, time-efficient, and consistent segmentation of anatomical landmarks, serving the process of virtual patient creation. Additionally, currently available systems for virtual implant placement demonstrate different degrees of automation. It is important to highlight that, as of now, full automation of this process has not been documented nor scientifically validated. Scientific and clinical validation of AI applications for presurgical dental implant planning is currently scarce. The present review allows the clinician to identify AI-based automation in presurgical dental implant planning and assess the potential underlying scientific validation.",10.1016/j.jdent.2024.104862,3D imaging; Artificial intelligence; Cone-beam computed tomography; Deep learning; Dental implant; Implant dentistry
37355089,Ethical considerations on artificial intelligence in dentistry: A framework and checklist.,"Rokhshad, Rata; Ducret, Maxime; Chaurasia, Akhilanand; Karteva, Teodora; Radenkovic, Miroslav; Roganovic, Jelena; Hamdan, Manal; Mohammad-Rahimi, Hossein; Krois, Joachim; Lahoud, Pierre; Schwendicke, Falk",Journal of dentistry,Aug 2023,"Artificial Intelligence (AI) refers to the ability of machines to perform cognitive and intellectual human tasks. In dentistry, AI offers the potential to enhance diagnostic accuracy, improve patient outcomes and streamline workflows. The present study provides a framework and a checklist to evaluate AI applications in dentistry from this perspective. Lending from existing guidance documents, an initial draft of the checklist and an explanatory paper were derived and discussed among the groups members. The checklist was consented to in an anonymous voting process by 29 Topic Group Dental Diagnostics and Digital Dentistry, ITU/WHO Focus Group AI on Health's members. Overall, 11 principles were identified (diversity, transparency, wellness, privacy protection, solidarity, equity, prudence, law and governance, sustainable development, accountability, and responsibility, respect of autonomy, decision-making). Providers, patients, researchers, industry, and other stakeholders should consider these principles when developing, implementing, or receiving AI applications in dentistry. While AI has become increasingly commonplace in dentistry, there are ethical concerns around its usage, and users (providers, patients, and other stakeholders), as well as the industry should consider these when developing, implementing, or receiving AI applications based on comprehensive framework to address the associated ethical challenges.",10.1016/j.jdent.2023.104593,Artificial intelligence; Bioethics; Deep learning; Dentistry; Machine learning
37665008,Applications of artificial intelligence in the analysis of dental panoramic radiographs: an overview of systematic reviews.,"Turosz, Natalia; Chęcińska, Kamila; Chęciński, Maciej; Brzozowska, Anita; Nowak, Zuzanna; Sikora, Maciej",Dento maxillo facial radiology,Oct 2023,"This overview of systematic reviews aimed to establish the current state of knowledge on the suitability of artificial intelligence (AI) in dental panoramic radiograph analysis and illustrate its changes over time. Medical databases covered by the Association for Computing Machinery, Bielefeld Academic Search Engine, Google Scholar, and PubMed engines were searched. The risk of bias was assessed using ROBIS tool. Ultimately, 12 articles were qualified for the qualitative synthesis. The results were visualized with timelines, tables, and charts. In the years 1988-2023, a significant development of information technologies for the analysis of DPRs was observed. The latest analyzed AI models achieve high accuracy in detecting caries (91.5%), osteoporosis (89.29%), maxillary sinusitis (87.5%), periodontal bone loss (93.09%), and teeth identification and numbering (93.67%). The detection of periapical lesions is also characterized by high sensitivity (99.95%) and specificity (92%). However, due to the small number of heterogeneous source studies synthesized in systematic reviews, the results of this overview should be interpreted with caution. Currently, AI applications can significantly support dentists in dental panoramic radiograph analysis. As systematic reviews on AI become outdated quickly, their regular updating is recommended. PROSPERO registration number: CRD42023416048.",10.1016/j.jclinepi.2015.06.005,Artificial Intelligence; Deep learning; Dental radiography; Overview of reviews; Panoramic radiographs
38520195,"The Role, Applications and Challenges of Artificial Intelligence in Dentistry.","Blum, Igor R",Primary dental journal,Mar 2024,,10.1177/20501684241235760,
37283008,"Characteristics, Impact, and Visibility of Scientific Publications on Artificial Intelligence in Dentistry: A Scientometric Analysis.","Velasquez, Ricardo; Barja-Ore, John; Salazar-Salvatierra, Emma; Gutiérrez-Ilave, Margot; Mauricio-Vilchez, Cesar; Mendoza, Roman; Mayta-Tovalino, Frank",The journal of contemporary dental practice,01 Aug 2022,"To analyze the bibliometric characteristics, impact, and visibility of scientific publications on artificial intelligence (AI) in dentistry in Scopus. Descriptive and cross-sectional bibliometric study, based on the systematic search of information in Scopus between 2017 and July 10, 2022. The search strategy was elaborated with Medical Subject Headings (MeSH) and Boolean operators. The analysis of bibliometric indicators was performed with Elsevier's SciVal program. From 2017 to 2022, the number of publications in indexed scientific journals increased, especially in the Q1 (56.1%) and Q2 (30.6%) quartile. Among the journals with the highest production, the majority was from the United States and the United Kingdom, and the Journal of Dental Research has the highest impact (14.9 citations per publication) and the most publications (31). In addition, the Charité - Universitätsmedizin Berlin (FWCI: 8.24) and Krois Joachim (FWCI: 10.09) from Germany were the institution and author with the highest expected performance relative to the world average, respectively. The United States is the country with the highest number of published papers. There is an increasing tendency to increase the scientific production on artificial intelligence in the field of dentistry, with a preference for publication in prestigious scientific journals of high impact. Most of the productive authors and institutions were from Japan. There is a need to promote and consolidate strategies to develop collaborative research both nationally and internationally.",10.5005/jp-journals-10024-3386,Artificial intelligence; Bibliometric analysis; Deep learning; Dentistry Machine learning.
34406309,Demystifying artificial intelligence and deep learning in dentistry.,"Rodrigues, Jonas Almeida; Krois, Joachim; Schwendicke, Falk",Brazilian oral research,2021,"Artificial intelligence (AI) is a general term used to describe the development of computer systems which can perform tasks that normally require human cognition. Machine learning (ML) is one subfield of AI, where computers learn rules from data, capturing its intrinsic statistical patterns and structures. Neural networks (NNs) have been increasingly employed for ML complex data. The application of multilayered NN is referred to as ""deep learning"", which has been recently investigated in dentistry. Convolutional neural networks (CNNs) are mainly used for processing large and complex imagery data, as they are able to extract image features like edges, corners, shapes, and macroscopic patterns using layers of filters. CNN algorithms allow to perform tasks like image classification, object detection and segmentation. The literature involving AI in dentistry has increased rapidly, so a methodological guidance for designing, conducting and reporting studies must be rigorously followed, including the improvement of datasets. The limited interaction between the dental field and the technical disciplines, however, remains a hurdle for applicable dental AI. Similarly, dental users must understand why and how AI applications work and decide to appraise their decisions critically. Generalizable and robust AI applications will eventually prove helpful for clinicians and patients alike.",10.1590/1807-3107bor-2021.vol35.0094,
38347508,Research and application of artificial intelligence in dentistry from lower-middle income countries - a scoping review.,"Umer, Fahad; Adnan, Samira; Lal, Abhishek",BMC oral health,12 Feb 2024,"Artificial intelligence (AI) has been integrated into dentistry for improvement of current dental practice. While many studies have explored the utilization of AI in various fields, the potential of AI in dentistry, particularly in low-middle income countries (LMICs) remains understudied. This scoping review aimed to study the existing literature on the applications of artificial intelligence in dentistry in low-middle income countries. A comprehensive search strategy was applied utilizing three major databases: PubMed, Scopus, and EBSCO Dentistry & Oral Sciences Source. The search strategy included keywords related to AI, Dentistry, and LMICs. The initial search yielded a total of 1587, out of which 25 articles were included in this review. Our findings demonstrated that limited studies have been carried out in LMICs in terms of AI and dentistry. Most of the studies were related to Orthodontics. In addition gaps in literature were noted such as cost utility and patient experience were not mentioned in the included studies.",10.1038/s41746-022-00700-y,Artificial intelligence; Deep learning; Dentistry; Machine learning
31386555,The use and performance of artificial intelligence applications in dental and maxillofacial radiology: A systematic review.,"Hung, Kuofeng; Montalvao, Carla; Tanaka, Ray; Kawai, Taisuke; Bornstein, Michael M",Dento maxillo facial radiology,Jan 2020,"To investigate the current clinical applications and diagnostic performance of artificial intelligence (AI) in dental and maxillofacial radiology (DMFR). Studies using applications related to DMFR to develop or implement AI models were sought by searching five electronic databases and four selected core journals in the field of DMFR. The customized assessment criteria based on QUADAS-2 were adapted for quality analysis of the studies included. The initial electronic search yielded 1862 titles, and 50 studies were eventually included. Most studies focused on AI applications for an automated localization of cephalometric landmarks, diagnosis of osteoporosis, classification/segmentation of maxillofacial cysts and/or tumors, and identification of periodontitis/periapical disease. The performance of AI models varies among different algorithms. The AI models proposed in the studies included exhibited wide clinical applications in DMFR. Nevertheless, it is still necessary to further verify the reliability and applicability of the AI models prior to transferring these models into clinical practice.",10.1109/IEMBS.2011.6091533,artificial intelligence; computer-assisted; dentistry; diagnostic imaging; radiography
38297447,Exploring the potential of artificial intelligence in paediatric dentistry: A systematic review on deep learning algorithms for dental anomaly detection.,"Hartman, Henri; Nurdin, Denny; Akbar, Saiful; Cahyanto, Arief; Setiawan, Arlette Suzy",International journal of paediatric dentistry,Sep 2024,"Artificial intelligence (AI) based on deep learning (DL) algorithms has shown promise in enhancing the speed and accuracy of dental anomaly detection in paediatric dentistry. This systematic review aimed to investigate the performance of AI systems in identifying dental anomalies in paediatric dentistry and compare it with human performance. A systematic search of Scopus, PubMed and Google Scholar was conducted from 2012 to 2022. Inclusion criteria were based on problem/patient/population, intervention/indicator, comparison and outcome scheme and specific keywords related to AI, DL, paediatric dentistry, dental anomalies, supernumerary and mesiodens. Six of 3918 initial pool articles were included, assessing nine DL sub-systems that used panoramic radiographs or cone-beam computed tomography. Article quality was assessed using QUADAS-2. Artificial intelligence systems based on DL algorithms showed promising potential in enhancing the speed and accuracy of dental anomaly detection, with an average of 85.38% accuracy and 86.61% sensitivity. Human performance, however, outperformed AI systems, achieving 95% accuracy and 99% sensitivity. Limitations included a limited number of articles and data heterogeneity. The potential of AI systems employing DL algorithms is highlighted in detecting dental anomalies in paediatric dentistry. Further research is needed to address limitations, explore additional anomalies and establish the broader applicability of AI in paediatric dentistry.",10.1111/ipd.13164,artificial intelligence; cone‐beam computed tomography; deep learning; dental anomalies; panoramic radiography
