PMID,Title,Authors,Journal,Publication Date,Abstract,DOI,Keywords
40011130,"The Transformative Role of Artificial Intelligence in Dentistry: A Comprehensive Overview Part 2: The Promise and Perils, and the International Dental Federation Communique.","Tuygunov, Nozimjon; Samaranayake, Lakshman; Khurshid, Zohaib; Rewthamrongsris, Paak; Schwendicke, Falk; Osathanon, Thanaphum; Yahya, Noor Azlin",International dental journal,Apr 2025,"In the final part of this two part article on artificial intelligence (AI) in dentistry we review its transformative role, focusing on AI in dental education, patient communications, challenges of integration, strategies to overcome barriers, ethical considerations, and finally, the recently released International Dental Federation (FDI) Communique (white paper) on AI in Dentistry. AI in dental education is highlighted for its potential in enhancing theoretical and practical dimensions, including patient telemonitoring and virtual training ecosystems. Challenges of AI integration in dentistry are outlined, such as data availability, bias, and human accountability. Strategies to overcome these challenges include promoting AI literacy, establishing regulations, and focusing on specific AI implementations. Ethical considerations in AI integration within dentistry, such as patient privacy and algorithm bias, are emphasized. The need for clear guidelines and ongoing evaluation of AI systems is crucial. The FDI White Paper on AI in Dentistry provides insights into the significance of AI in oral care, dental education, and research, along with standards for governance. It discusses AI's impact on individual patients, community health, dental education, and research. The paper addresses biases, limited generalizability, accessibility, and regulatory requirements for AI in dental practice. In conclusion, AI plays a significant role in modern dental care, offering benefits in diagnosis, treatment planning, and decision-making. While facing challenges, strategic initiatives focusing on AI literacy, regulations, and targeted implementations can help overcome barriers and maximize the potential of AI in dentistry. Ethical considerations and ongoing evaluation are essential for ensuring responsible, effective and efficacious deployment of AI technologies in dental ecosystem.",10.1007/s11948-015-9652-2,AI Integration; Artificial Intelligence (AI); Ethics; Machine Learning; Patient Communication
35458927,"New Frontier in Advanced Dentistry: CBCT, Intraoral Scanner, Sensors, and Artificial Intelligence in Dentistry.","Kim, Seong-Hun; Kim, Ki Beom; Choo, HyeRan","Sensors (Basel, Switzerland)",12 Apr 2022,The advancement of science and technology has brought innovation in the dental field [...].,10.3390/s21217402,
39746083,Artificial intelligence in dentistry: Assessing the informational quality of YouTube videos.,"Naik, Sachin; Al-Kheraif, Abdulaziz Abdullah; Vellappally, Sajith",PloS one,2025,"The most widely used social media platform for video content is YouTubeTM. The present study evaluated the quality of information on YouTubeTM on artificial intelligence (AI) in dentistry. This cross-sectional study used YouTubeTM (https://www.youtube.com) for searching videos. The terms used for the search were ""artificial intelligence in dentistry,"" ""machine learning in dental care,"" and ""deep learning in dentistry."" The accuracy and reliability of the information source were assessed using the DISCERN score. The quality of the videos was evaluated using the modified Global Quality Score (mGQS) and the Journal of the American Medical Association (JAMA) score. The analysis of 91 YouTube™ videos on AI in dentistry revealed insights into video characteristics, content, and quality. On average, videos were 22.45 minutes and received 1715.58 views and 23.79 likes. The topics were mainly centered on general dentistry (66%), with radiology (18%), orthodontics (9%), prosthodontics (4%), and implants (3%). DISCERN and mGQS scores were higher for videos uploaded by healthcare professionals and educational content videos(P<0.05). DISCERN exhibited a strong correlation (0.75) with the video source and with JAMA (0.77). The correlation of the video's content and mGQS, was 0.66 indicated moderate correlation. YouTube™ has informative and moderately reliable videos on AI in dentistry. Dental students, dentists and patients can use these videos to learn and educate about artificial intelligence in dentistry. Professionals should upload more videos to enhance the reliability of the content.",10.1186/S12913-016-1691-0/TABLES/4,
39436248,[The use of artificial intelligence in modern dentistry in the Russian Federation].,"Losev, F F; Sorokina, A A; Salakhov, A K; Dokin, S P",Stomatologiia,2024,"The aim of the study is to identify the prospects and possibilities of using artificial intelligence (AI) and domestic software in the provision of organization dental care in the Russian Federation. An analysis of the actual situation on the use of domestic computer programs using AI for the provision of medical care in the Russian Federation was carried out based on information presented on the official websites of software developers, in scientific sources of information and analytical systems of the Higher Attestation Commission, eLibrary, PubMed, Scopus, Google Scholar. Content analysis and analytical method were used, followed by interpretation of the data and conclusions obtained. To date, information technologies and domestic software aimed at automation, improving safety and quality of medical care are being actively introduced. The requirements for AI-based programs are justified, namely: safety, accessibility for medical professionals and patients, as well as high competitiveness among developers. AI helps to process large amounts of medical data, contributes to the creation of a personalized approach to patient treatment, automates and optimizes administrative processes in healthcare, increases the accuracy of diagnosis, identification of early signs of the disease, predicts the outcome of treatment, neural networks accelerate the development of remote healthcare and telemedicine. However, it is the doctor who should be responsible for the decisions made based on the ""tips"" and recommendations of artificial intelligence. The use of computer programs using artificial intelligence in dentistry opens up significant prospects for improving the quality of medical care, interaction with patients and improving the level of education of doctors. The most popular programs will be in therapeutic and pediatric dentistry, aimed, among other things, at the prevention of dental diseases. Выявление перспектив и возможностей использования отечественного программного обеспечения с искусственным интеллектом (ИИ) в организации и оказании стоматологической помощи в Российской Федерации. Проведен анализ фактической ситуации по применению отечественных компьютерных программ с использованием ИИ для оказания медицинской помощи (МП) в Российской Федерации на основании сведений, представленных на официальных сайтах разработчиков программного обеспечения, в научных источниках информационно-аналитических систем ВАК, eLibrary, PubMed, Scopus, Google Scholar. Применяли контент-анализ и аналитический метод с последующей интерпретацией полученных данных и выводов. В настоящее время активно разрабатываются и внедряются в практическое здравоохранение информационные технологии и отечественное программное обеспечение, направленное на автоматизацию, повышение безопасности и качество оказания медицинской помощи. Обоснованы требования к программам на основе ИИ — безопасность, доступность для медицинских специалистов и пациентов. ИИ помогает обрабатывать большие объемы медицинских данных, способствует созданию персонализированного подхода к лечению пациентов, автоматизируются и оптимизируются административные процессы в здравоохранении, повышается точность постановки диагноза, идентификации ранних признаков заболевания, прогнозируется исход лечения, ускоряется развитие дистанционного здравоохранения и телемедицины. Однако именно врач должен нести ответственность за принятые решения на основе «подсказок» и рекомендаций ИИ. Применение компьютерных программ с использованием ИИ в стоматологии открывает значительные перспективы для улучшения качества оказания медицинской помощи, взаимодействия с пациентами и повышения уровня образования врачей. Наиболее востребованными будут программы по терапевтической и детской стоматологии, направленные в том числе на профилактику стоматологических заболеваний.",10.17116/stomat202410305142,artificial intelligence; caries prediction; dental care; diagnostics; neural networks
37793819,Applications and performance of artificial intelligence models in removable prosthodontics: A literature review.,"Ali, Islam E; Tanikawa, Chihiro; Chikai, Manabu; Ino, Shuichi; Sumita, Yuka; Wakabayashi, Noriyuki",Journal of prosthodontic research,08 Jul 2024,"In this narrative review, we present the current applications and performances of artificial intelligence (AI) models in different phases of the removable prosthodontic workflow and related research topics. A literature search was conducted using PubMed, Scopus, Web of Science, and Google Scholar databases between January 2010 and January 2023. Search terms related to AI were combined with terms related to removable prosthodontics. Articles reporting the structure and performance of the developed AI model were selected for this literature review. A total of 15 articles were relevant to the application of AI in removable prosthodontics, including maxillofacial prosthetics. These applications included the design of removable partial dentures, classification of partially edentulous arches, functional evaluation and outcome prediction in complete denture treatment, early prosthetic management of patients with cleft lip and palate, coloration of maxillofacial prostheses, and prediction of the material properties of denture teeth. Various AI models with reliable prediction accuracy have been developed using supervised learning. The current applications of AI in removable prosthodontics exhibit significant potential for improving the prosthodontic workflow, with high accuracy levels reported in most of the reviewed studies. However, the focus has been predominantly on the diagnostic phase, with few studies addressing treatment planning and implementation. Because the number of AI-related studies in removable prosthodontics is limited, more models targeting different prosthodontic disciplines are required.",10.2186/jpr.JPR_D_23_00073,Artificial intelligence; Machine learning; Maxillofacial prosthodontics; Removable prosthodontics
38579110,Artificial Intelligence (AI) Role in Implant Dentistry.,"Rutkowski, James L",The Journal of oral implantology,01 Feb 2024,,10.1563/Editorial,
35162751,Artificial Intelligence: A New Diagnostic Software in Dentistry: A Preliminary Performance Diagnostic Study.,"De Angelis, Francesca; Pranno, Nicola; Franchina, Alessio; Di Carlo, Stefano; Brauner, Edoardo; Ferri, Agnese; Pellegrino, Gerardo; Grecchi, Emma; Goker, Funda; Stefanelli, Luigi Vito",International journal of environmental research and public health,02 Feb 2022,"Artificial intelligence (AI) has taken hold in public health because more and more people are looking to make a diagnosis using technology that allows them to work faster and more accurately, reducing costs and the number of medical errors. In the present study, 120 panoramic X-rays (OPGs) were randomly selected from the Department of Oral and Maxillofacial Sciences of Sapienza University of Rome, Italy. The OPGs were acquired and analyzed using Apox, which takes a panoramic X-rayand automatically returns the dental formula, the presence of dental implants, prosthetic crowns, fillings and root remnants. A descriptive analysis was performed presenting the categorical variables as absolute and relative frequencies. In total, the number of true positive (TP) values was 2.195 (19.06%); true negative (TN), 8.908 (77.34%); false positive (FP), 132 (1.15%); and false negative (FN), 283 (2.46%). The overall sensitivity was 0.89, while the overall specificity was 0.98. The present study shows the latest achievements in dentistry, analyzing the application and credibility of a new diagnostic method to improve the work of dentists and the patients' care.",10.1016/j.compbiomed.2019.02.017,accuracy; artificial intelligence; dental radiology; digital dentistry; machine learning
36914305,"ARTIFICIAL INTELLIGENCE (AI) AS AN AID IN RESTORATIVE DENTISTRY IS PROMISING, BUT STILL A WORK IN PROGRESS.","Alqutaibi, Ahmed Yaseen; Aboalrejal, Afaf Noman",The journal of evidence-based dental practice,Mar 2023,"Artificial intelligence applications in restorative dentistry: A systematic review. Revilla-León, M., Gómez-Polo, M., Vyas, S., Barmak, A. B., Özcan, M., Att, W., & Krishnamurthy, V. R. J Prosthet Dent 2021 SOURCE OF FUNDING: Not reported. Systematic review.",10.1016/j.jebdp.2023.101837,AI; Artificial intelligence; Dental caries; Machine learning; Restorative dentistry; Root fracture
40074616,"The Transformative Role of Artificial Intelligence in Dentistry: A Comprehensive Overview. Part 1: Fundamentals of AI, and its Contemporary Applications in Dentistry.","Samaranayake, Lakshman; Tuygunov, Nozimjon; Schwendicke, Falk; Osathanon, Thanaphum; Khurshid, Zohaib; Boymuradov, Shukhrat A; Cahyanto, Arief",International dental journal,Apr 2025,"Artificial intelligence (AI) holds immense promise in revolutionising dentistry, spanning, diagnostics, treatment planning and educational realms. This narrative review, in two parts, explores the fundamentals and the multifaceted potential of AI in dentistry. The current article explores the profound impact of AI in dentistry, encompassing diagnostic tools, treatment planning, and patient care. The Part 2 of the article delves into the potential of AI in patient education, ethics and the FDI communique on AI in dentistry. The review begins by elucidating the historical context of AI, outlining its recent widespread use in various sectors, including medicine and dentistry. The narrative delves into the fundamental concepts of AI, which entails developing machines capable of executing tasks that typically necessitate human intellect. In the biomedical realm, AI has evolved from exploring computational models to constructing systems for clinical data processing and interpretation, aiming to enhance medical/dental decision-making. The discussion delves into the pivotal role of AI models in dentistry, such as Large Language Models (LLM), Large Vision Models (LVM), and Multimodality Models (MM), revolutionizing processes from clinical documentation to treatment planning. The narrative extends to the applications of AI in dental specialties such as periodontics, endodontics, oral medicine and pathology, restorative dentistry, prosthodontics, paediatric dentistry, forensic odontology, oral and maxillofacial surgery, orthodontics, and orofacial pain management. AI's role in improving treatment outcomes, diagnostic accuracy, and decision-making processes is evident across these specialties, showcasing its potential in transforming dental care. The review concludes by highlighting the need for continued validation, interdisciplinary collaboration, and regulatory frameworks to ensure the seamless integration of AI into dentistry, paving the way for enhanced patient outcomes and evidence-based practice in the field.",10.2147/NSS.S320664,"AI,; Artificial intelligence; Challenge; Dentistry; Literacy; Oral health; Petient care"
34493389,"Comments on ""Artificial intelligence applications in restorative dentistry: A systematic review"".","Habib, Saqib; Umer, Fahad",The Journal of prosthetic dentistry,Jan 2022,,10.1016/j.prosdent.2021.08.003,
37392423,Detecting dental caries on oral photographs using artificial intelligence: A systematic review.,"Moharrami, Mohammad; Farmer, Julie; Singhal, Sonica; Watson, Erin; Glogauer, Michael; Johnson, Alistair E W; Schwendicke, Falk; Quinonez, Carlos",Oral diseases,May 2024,"This systematic review aimed at evaluating the performance of artificial intelligence (AI) models in detecting dental caries on oral photographs. Methodological characteristics and performance metrics of clinical studies reporting on deep learning and other machine learning algorithms were assessed. The risk of bias was evaluated using the quality assessment of diagnostic accuracy studies 2 (QUADAS-2) tool. A systematic search was conducted in EMBASE, Medline, and Scopus. Out of 3410 identified records, 19 studies were included with six and seven studies having low risk of biases and applicability concerns for all the domains, respectively. Metrics varied widely and were assessed on multiple levels. F1-scores for classification and detection tasks were 68.3%-94.3% and 42.8%-95.4%, respectively. Irrespective of the task, F1-scores were 68.3%-95.4% for professional cameras, 78.8%-87.6%, for intraoral cameras, and 42.8%-80% for smartphone cameras. Limited studies allowed assessing AI performance for lesions of different severity. Automatic detection of dental caries using AI may provide objective verification of clinicians' diagnoses and facilitate patient-clinician communication and teledentistry. Future studies should consider more robust study designs, employ comparable and standardized metrics, and focus on the severity of caries lesions.",10.1111/odi.14659,deep learning; dental caries; intraoral camera; oral photograph; smartphone
39600121,Mapping the Use of Artificial Intelligence-Based Image Analysis for Clinical Decision-Making in Dentistry: A Scoping Review.,"Chen, Wei; Dhawan, Monisha; Liu, Jonathan; Ing, Damie; Mehta, Kruti; Tran, Daniel; Lawrence, Daniel; Ganhewa, Max; Cirillo, Nicola",Clinical and experimental dental research,Dec 2024,"Artificial intelligence (AI) is an emerging field in dentistry. AI is gradually being integrated into dentistry to improve clinical dental practice. The aims of this scoping review were to investigate the application of AI in image analysis for decision-making in clinical dentistry and identify trends and research gaps in the current literature. This review followed the guidelines provided by the Preferred Reporting Items for Systematic Reviews and Meta-Analyses Extension for Scoping Reviews (PRISMA-ScR). An electronic literature search was performed through PubMed and Scopus. After removing duplicates, a preliminary screening based on titles and abstracts was performed. A full-text review and analysis were performed according to predefined inclusion criteria, and data were extracted from eligible articles. Of the 1334 articles returned, 276 met the inclusion criteria (consisting of 601,122 images in total) and were included in the qualitative synthesis. Most of the included studies utilized convolutional neural networks (CNNs) on dental radiographs such as orthopantomograms (OPGs) and intraoral radiographs (bitewings and periapicals). AI was applied across all fields of dentistry - particularly oral medicine, oral surgery, and orthodontics - for direct clinical inference and segmentation. AI-based image analysis was use in several components of the clinical decision-making process, including diagnosis, detection or classification, prediction, and management. A variety of machine learning and deep learning techniques are being used for dental image analysis to assist clinicians in making accurate diagnoses and choosing appropriate interventions in a timely manner.",10.3390/DIAGNOSTICS11091664,artificial intelligence; convolutional neural networks; dentistry; image analysis
34610222,Machine learning in orthodontics: Challenges and perspectives.,"Liu, Jialing; Chen, Ye; Li, Shihao; Zhao, Zhihe; Wu, Zhihong",Advances in clinical and experimental medicine : official organ Wroclaw Medical University,Oct 2021,"Artificial intelligence (AI) applications have significantly improved our everyday quality of life. The last decade has witnessed the emergence of up-and-coming applications in the field of dentistry. It is hopeful that AI, especially machine learning (ML), due to its powerful capacity for image processing and decision support systems, will find extensive application in orthodontics in the future. We performed a comprehensive literature review of the latest studies on the application of ML in orthodontic procedures, including diagnosis, decision-making and treatment. Machine learning models have been found to perform similar to or with even higher accuracy than humans in landmark identification, skeletal classification, bone age prediction, and tooth segmentation. Meanwhile, compared to human experts, ML algorithms allow for high agreement and stability in orthodontic decision-making procedures and treatment effect evaluation. However, current research on ML raises important questions regarding its interpretability and dataset sample reliability. Therefore, more collaboration between orthodontic professionals and technicians is urged to achieve a positive symbiosis between AI and the clinic.",10.17219/acem/138702,artificial intelligence (AI); convolutional neural network (CNN); machine learning; neural network; orthodontics
31061991,Editorial: Artificial intelligence and team work in dentistry.,"Devigus, Alessandro; Pietrobon, Nicola",The international journal of esthetic dentistry,2019,,,
36901630,Artificial Intelligence as a Decision-Making Tool in Forensic Dentistry: A Pilot Study with I3M.,"Bui, Romain; Iozzino, Régis; Richert, Raphaël; Roy, Pascal; Boussel, Loïc; Tafrount, Cheraz; Ducret, Maxime",International journal of environmental research and public health,06 Mar 2023,"Expert determination of the third molar maturity index (I3M) constitutes one of the most common approaches for dental age estimation. This work aimed to investigate the technical feasibility of creating a decision-making tool based on I3M to support expert decision-making. Methods: The dataset consisted of 456 images from France and Uganda. Two deep learning approaches (Mask R-CNN, U-Net) were compared on mandibular radiographs, leading to a two-part instance segmentation (apical and coronal). Then, two topological data analysis approaches were compared on the inferred mask: one with a deep learning component (TDA-DL), one without (TDA). Regarding mask inference, U-Net had a better accuracy (mean intersection over union metric (mIoU)), 91.2% compared to 83.8% for Mask R-CNN. The combination of U-Net with TDA or TDA-DL to compute the I3M score revealed satisfying results in comparison with a dental forensic expert. The mean ± SD absolute error was 0.04 ± 0.03 for TDA, and 0.06 ± 0.04 for TDA-DL. The Pearson correlation coefficient of the I3M scores between the expert and a U-Net model was 0.93 when combined with TDA and 0.89 with TDA-DL. This pilot study illustrates the potential feasibility to automate an I3M solution combining a deep learning and a topological approach, with 95% accuracy in comparison with an expert.",10.1016/j.jds.2022.12.003,age estimation; artificial intelligence; deep learning; dentistry; machine learning; neural network; topological analysis
