PMID,Title,Authors,Journal,Publication Date,Abstract,DOI,Keywords
34233515,Current applications and development of artificial intelligence for digital dental radiography.,"Putra, Ramadhan Hardani; Doi, Chiaki; Yoda, Nobuhiro; Astuti, Eha Renwi; Sasaki, Keiichi",Dento maxillo facial radiology,01 Jan 2022,"In the last few years, artificial intelligence (AI) research has been rapidly developing and emerging in the field of dental and maxillofacial radiology. Dental radiography, which is commonly used in daily practices, provides an incredibly rich resource for AI development and attracted many researchers to develop its application for various purposes. This study reviewed the applicability of AI for dental radiography from the current studies. Online searches on PubMed and IEEE Xplore databases, up to December 2020, and subsequent manual searches were performed. Then, we categorized the application of AI according to similarity of the following purposes: diagnosis of dental caries, periapical pathologies, and periodontal bone loss; cyst and tumor classification; cephalometric analysis; screening of osteoporosis; tooth recognition and forensic odontology; dental implant system recognition; and image quality enhancement. Current development of AI methodology in each aforementioned application were subsequently discussed. Although most of the reviewed studies demonstrated a great potential of AI application for dental radiography, further development is still needed before implementation in clinical routine due to several challenges and limitations, such as lack of datasets size justification and unstandardized reporting format. Considering the current limitations and challenges, future AI research in dental radiography should follow standardized reporting formats in order to align the research designs and enhance the impact of AI development globally.",10.1148/radiol.2017171920,Artificial intelligence; deep learning; machine learning; radiography
40195079,Artificial Intelligence in Dentistry: A Narrative Review of Diagnostic and Therapeutic Applications.,"Gao, Sizhe; Wang, Xianyun; Xia, Zhuoheng; Zhang, Huicong; Yu, Jun; Yang, Fan",Medical science monitor : international medical journal of experimental and clinical research,08 Apr 2025,"Advancements in digital and precision medicine have fostered the rapid development of artificial intelligence (AI) applications, including machine learning, artificial neural networks (ANN), and deep learning, within the field of dentistry, particularly in imaging diagnosis and treatment. This review examines the progress of AI across various domains of dentistry, focusing on its role in enhancing diagnostics and optimizing treatment for oral diseases such as endodontic disease, periodontal disease, oral implantology, orthodontics, prosthodontic treatment, and oral and maxillofacial surgery. Additionally, it discusses the emerging opportunities and challenges associated with these technologies. The findings indicate that AI can be effectively utilized in numerous aspects of oral healthcare, including prevention, early screening, accurate diagnosis, treatment plan design assistance, treatment execution, follow-up monitoring, and prognosis assessment. However, notable challenges persist, including issues related to inaccurate data annotation, limited capability for fine-grained feature expression, a lack of universally applicable models, potential biases in learning algorithms, and legal risks pertaining to medical malpractice and data privacy breaches. Looking forward, future research is expected to concentrate on overcoming these challenges to enhance the accuracy and applicability of AI in diagnosing and treating oral diseases. This review aims to provide a comprehensive overview of the current state of AI in dentistry and to identify pathways for its effective integration into clinical practice.",10.2139/ssrn.3361280,
31710003,Artificial intelligence - The next frontier in pediatric dentistry.,"Baliga, M Sudhindra",Journal of the Indian Society of Pedodontics and Preventive Dentistry,2019,,10.4103/JISPPD.JISPPD_319_19,
36269515,Artificial intelligence models for clinical usage in dentistry with a focus on dentomaxillofacial CBCT: a systematic review.,"Mureșanu, Sorana; Almășan, Oana; Hedeșiu, Mihaela; Dioșan, Laura; Dinu, Cristian; Jacobs, Reinhilde",Oral radiology,Jan 2023,"This study aimed at performing a systematic review of the literature on the application of artificial intelligence (AI) in dental and maxillofacial cone beam computed tomography (CBCT) and providing comprehensive descriptions of current technical innovations to assist future researchers and dental professionals. The Preferred Reporting Items for Systematic Reviews and Meta-Analyses Protocols (PRISMA) Statement was followed. The study's protocol was prospectively registered. Following databases were searched, based on MeSH and Emtree terms: PubMed/MEDLINE, Embase and Web of Science. The search strategy enrolled 1473 articles. 59 publications were included, which assessed the use of AI on CBCT images in dentistry. According to the PROBAST guidelines for study design, seven papers reported only external validation and 11 reported both model building and validation on an external dataset. 40 studies focused exclusively on model development. The AI models employed mainly used deep learning models (42 studies), while other 17 papers used conventional approaches, such as statistical-shape and active shape models, and traditional machine learning methods, such as thresholding-based methods, support vector machines, k-nearest neighbors, decision trees, and random forests. Supervised or semi-supervised learning was utilized in the majority (96.62%) of studies, and unsupervised learning was used in two (3.38%). 52 publications included studies had a high risk of bias (ROB), two papers had a low ROB, and four papers had an unclear rating. Applications based on AI have the potential to improve oral healthcare quality, promote personalized, predictive, preventative, and participatory dentistry, and expedite dental procedures.",10.1109/TMI.2016.2528162,Artificial intelligence; Cone beam computed tomography; Deep learning; Dentistry
37083609,What every dentist needs to know about the use of artificial intelligence in dentistry.,"Nazemian, Suephie; Boggs, Steven T; Jimenez Ciriaco, Elvia; Abu Shakra, Heba; Jung, Esther Y; Lotfalikhan-Zand, Yasmin B; Price, Jeffery B; Bashirelahi, Nasir",General dentistry,2023,"Artificial intelligence (AI) is a division of computer science that allows machines to emulate human cognitive processes. In dentistry, AI is applied in clinical decision-making and can aid in detecting disease and predicting patterns based on existing data sets. AI can assist clinicians by quickly analyzing massive amounts of data to improve workflow, identify patterns of disease, provide risk assessment, and create individualized patient-centered treatment plans. AI has been shown to increase efficiency in the office by aiding in scheduling, tracking, and updating patient records to better organize patient data. The objective of this article is to outline the various applications of AI in different dental specialties. Applications range from business functions such as marketing, cyber security, and report writing to clinical uses such as lesion detection and surgical guidance. This review will also discuss some of the ethical considerations and drawbacks associated with implementing AI in the dental practice.",,artificial intelligence; artificial intelligence-driven remote monitoring; implant planning; predictive artificial intelligence; targeted endodontic microsurgery
39654301,Artificial intelligence applications in smile design dentistry: A scoping review.,"Baaj, Rakan E; Alangari, Talal A",Journal of prosthodontics : official journal of the American College of Prosthodontists,Apr 2025,"Artificial intelligence (AI) applications are growing in smile design and aesthetic procedures. The current expansion and performance of AI models in digital smile design applications have not yet been systematically documented and analyzed. The purpose of this review was to assess the performance of AI models in smile design, assess the criteria of points of reference using AI analysis, and assess different AI software performance. An electronic review was completed in five databases: MEDLINE/PubMed, EMBASE, World of Science, Cochrane, and Scopus. Studies that developed AI models for smile design were included. The search strategy included articles published until November 1, 2024. Two investigators independently evaluated the quality of the studies by applying the Joanna Briggs Institute (JBI) Critical Appraisal Checklist for Quasi-Experimental Studies and Textual Evidence: Expert Opinion Results. The search resulted in 2653 articles. A total of 2649 were excluded according to the exclusion criteria after reading the title, abstract, and/or full-text review. Four articles published between 2023 and 2024 were included in the present investigation. Two articles compared 2D and 3D points while one article compared the outcome of satisfaction between dentists and patients, and the last article emphasized the ethical components of using AI. The results of the studies reviewed in this paper suggest that AI-generated smile designs are not significantly different from manually created designs in terms of esthetic perception. 3D designs are more accurate than 2D designs and offer more advantages. More articles are needed in the field of AI and smile design.",10.1111/jopr.14000,AI; artificial intelligence; deep learning; smile design
40016901,[Artificial Intelligence in Dentistry: A Sign of the Times].,"Oisieva, K Sh; Rozov, R A",Stomatologiia,2025,"Artificial Intelligence (AI) has emerged as one of the most significant innovations in dentistry, enabling the efficient analysis of large volumes of data and enhancing the quality of diagnosis and treatment. Is to conduct a systematic review of the existing literature related to the application of AI in dental imaging. T. The study included works where AI was used for the analysis of dental images, with a focus on deep learning methods and convolutional neural networks. The search was conducted in six leading databases, including PubMed, IEEE Xplore and others. AI significantly improves the accuracy of diagnosing dental conditions, such as caries and periodontitis, and promotes a more personalized approach to patient treatment. However, existing studies are often limited by small data sets, highlighting the need for further research. AI has the potential to greatly enhance dental practice, but its full integration into clinical practice requires additional studies. The legal regulation of AI use is also an important aspect to consider. Искусственный интеллект (ИИ) стал одной из наиболее важных инноваций в области стоматологии, позволяя эффективно анализировать большие объемы данных и повышать качество диагностики и лечения. Провести систематический обзор существующей литературы, касающейся применения ИИ в стоматологии. В исследование включены работы, где ИИ применялся для решения проблем в стоматологии, с акцентом на методы глубокого обучения и сверточные нейронные сети. Поиск был проведен в шести ведущих базах данных, таких как PubMed, IEEE Xplore и др. ИИ существенно повышает точность диагностики стоматологических заболеваний, включая кариес и пародонтит, и способствует более персонализированному подходу к лечению. Тем не менее, существующие исследования часто ограничены небольшими объемами данных, что подчеркивает необходимость дальнейших исследований. ИИ обладает потенциалом для значительного улучшения стоматологической практики, однако его полноценное внедрение в клиническую практику требует дополнительных исследований. Важным аспектом также является правовое регулирование использования ИИ.",10.17116/stomat202510401187,artificial intelligence; convolutional neural networks; deep learning; dentistry; diagnosis; legal regulation
38847140,Applications of artificial intelligence in restorative dentistry: a scoping review.,"Aziz, Ahmed M; Hamdoon, Zaid; Husein, Adam Bin; Dheyab, Shaima; Obaid, Fajer","Quintessence international (Berlin, Germany : 1985)",28 Jun 2024,"Artificial intelligence (AI) applications in restorative dentistry have remarkably increased in the past 5 years. This review outlines the applications, promises, and limitations of AI in the most performed procedures in restorative dentistry. An electronic search was performed in four databases: MEDLINE/PubMed, Embase, Web of Science, and Scopus. The search included articles published in English language without date restriction. Two independent reviewers assessed the eligibility of the studies and performed data extraction. Any discrepancy was resolved by the consensus of a third reviewer. A total of 33 studies were included in this review. For AI applications in restorative dentistry, the included studies were classified into three main groups: (1) diagnosis, detection, and prediction of the disease, (2) detection and prediction of the longevity of dental restorations, and (3) teeth detection and treatments. For each study, the AI model, type of dataset, sample size, and main results (accuracy, precision, sensitivity, and specificity) were reported. AI systems are promising as advantageous aids for diagnosis, prediction, and treatment in dentistry, with a high degree of accuracy. Despite the AI promises, several limitations are still unresolved and must be addressed to bridge the gap between technology and clinical applications.",10.3290/j.qi.b5437507,artificial intelligence; dental caries; dental prostheses; dental restoration failure; machine learning
37986239,Artificial intelligence systems in dental shade-matching: A systematic review.,"Shetty, Sthithika; Gali, Sivaranjani; Augustine, Dominic; Sv, Sowmya",Journal of prosthodontics : official journal of the American College of Prosthodontists,Jul 2024,"Uses for artificial intelligence (AI) are being explored in contemporary dentistry, but artificial intelligence in dental shade-matching has not been systematically reviewed and evaluated. The purpose of this systematic review was to evaluate the accuracy of artificial intelligence in predicting dental shades in restorative dentistry. A systematic electronic search was performed with the databases MEDLINE (PubMed), Scopus, Cochrane Library, and Google Scholar. A manual search was also conducted. All titles and abstracts were subject to the inclusion criteria of observational, interventional studies, and studies published in the English language. Narrative reviews, systematic reviews, case reports, case series, letters to the editor, commentaries, studies that were not AI-based, studies that were not related to dentistry, and studies that were related to other disciplines in dentistry, other than restorative dentistry (prosthodontics and endodontics) were excluded. Two investigators independently evaluated the quality assessment of the studies by applying the Joanna Briggs Institute Critical Appraisal Checklist for Quasi-Experimental Studies (non-randomized experimental studies). A third investigator was consulted to resolve the lack of consensus. Fifty-three articles were initially found from all the searches combined from articles published from 2008 till March 2023. A total of 15 articles met the inclusion criteria and were included in the systematic review. AI algorithms for shade-matching include fuzzy logic, a genetic algorithm with back-propagation neural network, back-propagation neural networks, convolutional neural networks, artificial neural networks, support vector machine algorithms, K-nearest neighbor with decision tree and random forest, deep learning for detection of dental prostheses based on object-detection applications, You Only Look Once-YOLO. Moment invariant was used for feature extraction.  XG (Xtreme Gradient) Boost was used in one study as a gradient-boosting machine learning algorithm. The highest accuracy in the prediction of dental shades was the decision tree regression model for leucite-based dental ceramics of 99.7% followed by the fuzzy decision of 99.62%, and support vector machine using cross-validation of 97%. Lighting conditions, shade-matching devices and color space models, and the type of AI algorithm influence the accuracy of the prediction of dental shades. Knowledge-based systems and neural networks have shown better accuracy in predicting dental shades.",10.1111/jopr.13805,artificial intelligence; deep learning; dental shades; dental shade‐matching; machine learning; neural networks; prosthesis coloring
37270174,What is the current state of artificial intelligence applications in dentistry and orthodontics?,"Fawaz, Paul; Sayegh, Patrick El; Vannet, Bart Vande","Journal of stomatology, oral and maxillofacial surgery",Oct 2023,"The use of Artificial Intelligence (AI) in the medical field has the potential to bring about significant improvements in patient care and outcomes. AI is being used in dentistry and more specifically in orthodontics through the development of diagnostic imaging tools, the development of treatment planning tools, and the development of robotic surgery. The aim of this study is to present the latest emerging AI softwares and applications in dental field to benefit from. Search strategies were conducted in three electronic databases, with no date limits in the following databases up to April 30, 2023: MEDLINE, PUBMED, and GOOGLE® SCHOLAR for articles related to AI in dentistry & orthodontics. No inclusion and exclusion criteria were used for the selection of the articles. Most of the articles included (n = 79) are reviews of the literature, retro/prospective studies, systematic reviews and meta-analyses, and observational studies. The use of AI in dentistry and orthodontics is a rapidly growing area of research and development, with the potential to revolutionize the field and bring about significant improvements in patient care and outcomes; this can save clinicians' chair-time and push for more individualized treatment plans. Results from the various studies reported in this review are suggestive that the accuracy of AI-based systems is quite promising and reliable. AI application in the healthcare field has proven to be efficient and helpful for the dentist to be more precise in diagnosis and clinical decision-making. These systems can simplify the tasks and provide results in quick time which can save dentists time and help them perform their duties more efficiently. These systems can be of greater aid and can be used as auxiliary support for dentists with lesser experience.",10.1016/j.jormas.2023.101524,Artificial intelligence; CBCT; Orthodontic diagnosis; Orthodontic treatment plan; Orthognatic surgery; Surgical treatment
34270881,Artificial intelligence in orthodontics: Where are we now? A scoping review.,"Monill-González, Anna; Rovira-Calatayud, Laia; d'Oliveira, Nuno Gustavo; Ustrell-Torrent, Josep M",Orthodontics & craniofacial research,Dec 2021,"This scoping review aims to determine the applications of Artificial Intelligence (AI) that are extensively employed in the field of Orthodontics, to evaluate its benefits, and to discuss its potential implications in this speciality. Recent decades have witnessed enormous changes in our profession. The arrival of new and more aesthetic options in orthodontic treatment, the transition to a fully digital workflow, the emergence of temporary anchorage devices and new imaging methods all provide both patients and professionals with a new focus in orthodontic care. This review was performed following the Preferred Reporting Items for Systematic reviews and Meta-Analyses extension for Scoping Reviews (PRISMA-ScR) guidelines. The electronic literature search was performed through MEDLINE/PubMed, Scopus, Web of Science, Cochrane and IEEE Xplore databases with a 11-year time restriction: January 2010 till March 2021. No additional manual searches were performed. The electronic literature search initially returned 311 records, and 115 after removing duplicate references. Finally, the application of the inclusion criteria resulted in 17 eligible publications in the qualitative synthesis review. The analysed studies demonstrated that Convolution Neural Networks can be used for the automatic detection of anatomical reference points on radiological images. In the growth and development research area, the Cervical Vertebral Maturation stage can be determined using an Artificial Neural Network model and obtain the same results as expert human observers. AI technology can also improve the diagnostic accuracy for orthodontic treatments, thereby helping the orthodontist work more accurately and efficiently.",10.1111/ocr.12517,artificial intelligence; machine learning; orthodontics; review
37532677,Applications of artificial intelligence in special care dentistry.,"Hassona, Yazan","Special care in dentistry : official publication of the American Association of Hospital Dentists, the Academy of Dentistry for the Handicapped, and the American Society for Geriatric Dentistry",2024,,10.1111/scd.12911,
34640948,The Use and Performance of Artificial Intelligence in Prosthodontics: A Systematic Review.,"Bernauer, Selina A; Zitzmann, Nicola U; Joda, Tim","Sensors (Basel, Switzerland)",05 Oct 2021,"(1) Background: The rapid pace of digital development in everyday life is also reflected in dentistry, including the emergence of the first systems based on artificial intelligence (AI). This systematic review focused on the recent scientific literature and provides an overview of the application of AI in the dental discipline of prosthodontics. (2) Method: According to a modified PICO-strategy, an electronic (MEDLINE, EMBASE, CENTRAL) and manual search up to 30 June 2021 was carried out for the literature published in the last five years reporting the use of AI in the field of prosthodontics. (3) Results: 560 titles were screened, of which 30 abstracts and 16 full texts were selected for further review. Seven studies met the inclusion criteria and were analyzed. Most of the identified studies reported the training and application of an AI system (",10.1371/journal.pone.0043312,artificial intelligence; deep learning; machine learning; neural networks; prosthetic treatment; reconstructive dentistry
38822561,The Use of Artificial Intelligence in Endodontics.,"Setzer, F C; Li, J; Khan, A A",Journal of dental research,Aug 2024,"Endodontics is the dental specialty foremost concerned with diseases of the pulp and periradicular tissues. Clinicians often face patients with varying symptoms, must critically assess radiographic images in 2 and 3 dimensions, derive complex diagnoses and decision making, and deliver sophisticated treatment. Paired with low intra- and interobserver agreement for radiographic interpretation and variations in treatment outcome resulting from nonstandardized clinical techniques, there exists an unmet need for support in the form of artificial intelligence (AI), providing automated biomedical image analysis, decision support, and assistance during treatment. In the past decade, there has been a steady increase in AI studies in endodontics but limited clinical application. This review focuses on critically assessing the recent advancements in endodontic AI research for clinical applications, including the detection and diagnosis of endodontic pathologies such as periapical lesions, fractures and resorptions, as well as clinical treatment outcome predictions. It discusses the benefits of AI-assisted diagnosis, treatment planning and execution, and future directions including augmented reality and robotics. It critically reviews the limitations and challenges imposed by the nature of endodontic data sets, AI transparency and generalization, and potential ethical dilemmas. In the near future, AI will significantly affect the everyday endodontic workflow, education, and continuous learning.",10.1016/j.ijmedinf.2022.104828,computer vision/convolutional neural networks; cracked teeth; decision making; deep learning/machine learning; diagnostic systems; treatment planning
